{
  "symbol": "000001.SZ",
  "stock_name": "示例公司",
  "scan": "分析日收盘后，公司量价和估值处于需要重新评估的状态；当日没有发现足以单独解释走势的公司公告。",
  "delta_summary": "相对原投资逻辑，最新财报继续确认主营增长，但现金流改善尚未同步，原先关于盈利质量的风险仍未解除。",
  "key_facts": [
    "最新定期报告显示主营收入继续增长，报告期和来源已在研究包中注明",
    "经营现金流增速低于净利润增速",
    "当前持仓、成本和可用现金以当天组合输入为准"
  ],
  "inferences": [
    "主营增长仍在延续，但现金流背离意味着利润质量尚未得到完整确认",
    "当前证据支持保留风险敞口，但不足以支持进一步增加仓位"
  ],
  "court": {
    "pro": [
      "主营增长和行业需求仍支持原投资逻辑",
      "当前价格相对历史估值已经回落"
    ],
    "con": [
      "现金流未同步改善，盈利质量仍有疑问",
      "近期量价没有形成持续的资金确认"
    ],
    "verdict": "HOLD。多数票支持维持现有持仓。正方关于主营增长的证据仍然成立，但反方指出的现金流背离尚未解决，因此当前投资逻辑没有被证伪，也没有足够证据增加风险敞口。该判断依赖主营增长延续且现金流没有进一步恶化；若后续事实推翻这些假设，应重新裁决。"
  },
  "price_impression": "合理",
  "recommended_action": "仅针对下一交易日：维持现有持仓，不进行买卖。高开、低开或盘中波动都不改变本次 HOLD；只有出现新的公司公告、财报修正或其他足以改变核心假设的事实时，才暂停执行并重新评估。",
  "action_type": "HOLD",
  "action_num": 0,
  "key_risks": [
    "经营现金流持续弱于净利润，可能说明盈利质量低于当前判断",
    "行业需求放缓可能使现有增长假设失效"
  ],
  "next_day_watchlist": [
    "核验公司是否发布新的公告或业绩修正",
    "核验行业需求和资金流数据是否出现与当前判断冲突的新变化"
  ],
  "confidence_score": 0.7
}
